{
  "$schema": "https://json-schema.org/draft/2020-12/schema",
  "$id": "https://example.com/expresto/middleware.config.schema.json",
  "title": "expRESTo Middleware Config",
  "type": "object",
  "additionalProperties": false,
  "required": ["port", "contextRoot", "controllersPath", "log"],
  "properties": {
    "port": { "type": "integer", "minimum": 1, "maximum": 65535 },
    "host": { "type": "string" },
    "contextRoot": { "type": "string", "pattern": "^/.*" },
    "controllersPath": { "type": "string", "minLength": 1 },

    "log": {
      "type": "object",
      "additionalProperties": false,
      "required": ["access", "application", "level"],
      "properties": {
        "access": { "type": "string" },
        "application": { "type": "string" },
        "level": { "type": "string" },
        "traceRequests": { "type": "boolean" }
      }
    },

    "cors": {
      "type": "object",
      "additionalProperties": false,
      "properties": {
        "enabled": { "type": "boolean" },
        "options": { "type": "object" }
      }
    },

    "helmet": {
      "type": "object",
      "additionalProperties": false,
      "properties": {
        "enabled": { "type": "boolean" },
        "options": { "type": "object" }
      }
    },

    "rateLimit": {
      "type": "object",
      "additionalProperties": false,
      "properties": {
        "enabled": { "type": "boolean" },
        "options": { "type": "object" }
      }
    },

    "auth": {
      "type": "object",
      "additionalProperties": false,
      "properties": {
        "jwt": {
          "type": "object",
          "additionalProperties": false,
          "properties": {
            "enabled": { "type": "boolean" },
            "secret": { "type": "string" },
            "algorithm": { "type": "string", "enum": ["HS256", "HS384", "HS512"] },
            "expiresIn": { "type": "string" }
          }
        },
        "basic": {
          "type": "object",
          "additionalProperties": false,
          "properties": {
            "enabled": { "type": "boolean" },
            "users": {
              "type": "object",
              "additionalProperties": { "type": "string" }
            }
          }
        }
      }
    },

    "cluster": {
      "type": "object",
      "additionalProperties": false,
      "properties": { "enabled": { "type": "boolean" } }
    },

    "metrics": {
      "type": "object",
      "additionalProperties": false,
      "properties": {
        "enabled": { "type": "boolean" },
        "endpoint": { "type": "string" }
      }
    },

    "ops": {
      "type": "object",
      "additionalProperties": false,
      "properties": {
        "enabled": { "type": "boolean" },
        "secure": { "type": "string", "enum": ["none", "basic", "jwt"] }
      }
    },

    "telemetry": {
      "type": "object",
      "additionalProperties": false,
      "properties": {
        "enabled": { "type": "boolean" },
        "serviceName": { "type": "string" }
      }
    },

    "scheduler": {
      "type": "object",
      "additionalProperties": false,
      "properties": {
        "enabled": { "type": "boolean" },
        "mode": { "type": "string", "enum": ["attached", "standalone"] },
        "timezone": { "type": "string" },
        "jobs": {
          "type": "object",
          "patternProperties": {
            "^[a-zA-Z0-9_-]+$": {
              "type": "object",
              "additionalProperties": false,
              "properties": {
                "enabled": { "type": "boolean" },
                "cron": { "type": "string" },
                "module": { "type": "string" },
                "timezone": { "type": "string" },
                "leaderOnly": { "type": "boolean" },
                "options": { "type": "object" }
              },
              "required": ["enabled", "cron", "module"]
            }
          }
        }
      }
    },

    "websocket": {
      "type": "object",
      "description": "WebSocket configuration",
      "additionalProperties": false,
      "properties": {
        "enabled": { "type": "boolean", "default": false },
        "path": { "type": "string", "default": "/socket.io" },
        "cors": {
          "type": "object",
          "additionalProperties": false,
          "properties": {
            "origin": {
              "anyOf": [
                { "type": "string" },
                {
                  "type": "array",
                  "items": { "type": "string" }
                }
              ]
            },
            "methods": {
              "type": "array",
              "items": { "type": "string" }
            }
          }
        }
      }
    }
  }
}
