{
  "port": 3002,
  "host": "127.0.0.1",
  "contextRoot": "/api",
  "controllersPath": "./tests/controllers",
  "log": {
    "access": "./logs/access.log",
    "application": "./logs/application.log",
    "level": "ERROR",
    "traceRequests": false
  },
  "auth": {
    "jwt": { "enabled": false },
    "basic": {
      "enabled": true,
      "users": { "alice": "password123" }
    }
  },
  "cors": { "enabled": true, "options": { "origin": "*" } },
  "helmet": { "enabled": true, "options": {} },
  "rateLimit": { "enabled": false, "options": {} },
  "cluster": { "enabled": false },
  "metrics": { "endpoint": "/__metrics" },
  "telemetry": { "enabled": true, "serviceName": "expresto-server-test" }
}
