{
  "port": 3001,
  "host": "127.0.0.1",
  "contextRoot": "/api",
  "controllersPath": "./tests/controllers",
  "log": {
    "access": "./logs/access.log",
    "application": "./logs/application.log",
    "level": "DEBUG",
    "traceRequests": false
  },
  "auth": {
    "jwt": {
      "enabled": true,
      "secret": "supersecretkey",
      "algorithm": "HS512",
      "expiresIn": "1h"
    }
  },
  "cors": {
    "enabled": true,
    "options": {
      "origin": "*"
    }
  },
  "helmet": {
    "enabled": true,
    "options": {}
  },
  "rateLimit": {
    "enabled": false,
    "options": {}
  },
  "cluster": {
    "enabled": false
  },
  "metrics": {
    "endpoint": "/__metrics"
  }
}
